status,product_area,response,justification,request_type
escalated,Claude,"I've escalated your request to our support team, and they will be in touch with you to verify your identity and assist with restoring access to your Claude team workspace. Please be prepared to provide additional information to facilitate this process.","The user is requesting restoration of access to their Claude team workspace, which involves account and permission management. Although this seems like a straightforward issue, it's crucial to verify the user's identity and their role within the team to ensure that access is granted appropriately, avoiding any potential security or access control issues.",product_issue
escalated,HackerRank,"I understand your concern about your test score, but I'm unable to review your answers or alter the outcome of the test. I'm escalating this issue to our support team for further review and assistance. Please allow us to investigate this matter further and we will be in touch with you soon.","The user is disputing their test score and requesting a review of their answers, as well as asking to be moved to the next round. This is a high-risk topic as it involves a potential issue with the grading system and a request to alter the outcome of the test, which could be related to cheating or unfair advantage.",product_issue
escalated,Visa,"I understand your concern and frustration with the situation. However, I need to escalate this issue to our dedicated support team, who will work with you to resolve the dispute and investigate the possibility of a refund. Please allow us to look into this matter further and contact you soon.","The issue involves a dispute with a merchant and a request for a refund, which may be related to unauthorized transactions or fraud. This topic is high-risk and requires further investigation and handling by a specialized team to ensure the security and integrity of the customer's account.",product_issue
replied,HackerRank,"I apologize for the inconvenience you're experiencing with your mock interviews. I'd be happy to help you troubleshoot the issue. Can you please provide more details about what happened when your mock interviews stopped? Additionally, I'll look into the refund process for you. Please note that our refund policy will be applied according to our terms and conditions. If you have any questions or concerns, feel free to ask.","The user is experiencing a technical issue with mock interviews, which is a product-related problem that can be addressed directly. The request for a refund is also related to the product issue, rather than a high-risk topic.",product_issue
escalated,Payments,"I've escalated your issue to our payments team, and they will investigate the matter with order ID cs_live_abcdefgh. You will be contacted soon to resolve the issue.","The user is reporting an issue with their payment, which could be related to a potential financial or transactional problem. This topic is sensitive and requires further investigation to ensure the user's concern is addressed properly and securely.",product_issue
escalated,HackerRank,"I've escalated your request to our dedicated support team, and they will be in touch with you to assist with the infosec process and provide the necessary guidance and support to ensure a secure and successful onboarding process with HackerRank.","The user is requesting help with the infosec process of their company, which may involve sensitive information and potentially high-risk topics such as security protocols and data handling. Although the user is planning to use HackerRank for hiring, which is a legitimate use case, the request for assistance with the infosec process may require specialized knowledge and handling to ensure the security and integrity of the company's data.",product_issue
replied,HackerRank Platform,"I'd be happy to help you with that. Can you please try clearing your browser cache and cookies, then log out and log back in to see if the ""apply"" tab appears? If the issue persists, please provide more details about your environment, such as the browser and operating system you're using, so we can further investigate the issue.","The user is experiencing a technical issue with the platform, specifically not being able to see the ""apply"" tab, which is a common feature for submitting coding challenges. This issue is not related to high-risk topics such as cheating, enterprise contract changes, or account deletions.",product_issue
replied,HackerRank,"I apologize for the issue you're experiencing with your submissions on HackerRank. Can you please try clearing your browser cache and cookies, then attempt to submit again? If the problem persists, please provide more details about the error message you're seeing or the specific challenge you're having trouble with, and I'll do my best to assist you further.","The user is reporting a technical issue with the website, specifically that none of their submissions are working across any challenges. This is a clear description of a problem that can be addressed by the support team, and it does not involve any high-risk topics such as cheating or enterprise contract changes.",bug
replied,HackerRank,"I apologize for the inconvenience you're experiencing with the compatibility check on HackerRank. It's possible that there's a technical issue with the zoom connectivity feature. Can you please try clearing your browser cache, checking your internet connection, and ensuring that your zoom settings are configured correctly? If the issue persists, our support team may need to investigate further to resolve the issue. Please provide us with more details about your system configuration and the error message you're seeing, so we can assist you better.","The user is reporting a specific issue with the compatibility check on the HackerRank platform, which is preventing them from taking a test. The issue is related to zoom connectivity, and the user has already attempted to troubleshoot by changing settings and system configurations. This suggests a potential bug or technical issue with the platform, rather than a high-risk topic such as cheating or enterprise contract changes.",bug
replied,HackerRank,"Dear [User], thank you for reaching out to us. I'd be happy to help you reschedule your HackerRank assessment. Could you please provide me with your available dates and times, and I'll do my best to accommodate your request? Additionally, please confirm your company name and the original scheduled time of the assessment so I can look into this further. I'll get back to you with an alternative date and time as soon as possible.","The user is requesting a rescheduling of their HackerRank assessment due to unforeseen circumstances, which is a reasonable and legitimate request. This is not related to any high-risk topics such as cheating, enterprise contract changes, or account deletions.",feature_request
replied,HackerRank,"Thank you for reaching out to us about the inactivity times issue. The current inactivity times are set to 20 minutes for both candidates and interviewers. However, we understand the concern that interviewers may be incorrectly identified as inactive while watching a screen share. We can review the possibility of extending the inactivity times or adjusting the detection mechanism to better accommodate screen sharing scenarios. I'll provide more information on our configuration options and see if we can implement a solution that works for your use case.","The ticket is requesting information about inactivity times and potential adjustments to improve the user experience, which is a product-related issue that can be addressed without involving high-risk topics such as cheating, enterprise contract changes, or account deletions.",product_issue
replied,General Support,"Sorry to hear that you're experiencing an issue. Could you please provide more details about what's not working, such as the product or service you're using and any error messages you've seen? This will help me better understand your problem and provide a more accurate solution.","The ticket lacks specific details about the issue, such as the product or service that's not working, making it difficult to provide a meaningful response. However, the language used doesn't indicate a high-risk topic, so it can be safely replied to with a request for more information.",invalid
replied,HackerRank,"To remove an interviewer from the platform, you can try the following steps: 1) Ensure you have the necessary permissions to manage users. 2) Go to the ""Interviewers"" or ""Users"" section, depending on your platform layout. 3) Click on the three dots next to the interviewer's name, then select ""Edit"" or a similar option. 4) Look for a ""Remove"" or ""Delete"" button, which may be available after editing the user's details. If you're still unable to find the option, please provide more details about your role and the platform layout you're using, and I'll be happy to help further.","The user is asking for assistance with a specific feature on the HackerRank platform, which is a common support query. The issue is not related to high-risk topics such as cheating, enterprise contract changes, or account deletions.",product_issue
replied,HackerRank Subscriptions,"Dear customer, thank you for reaching out to us. We can assist you with pausing your subscription. Please confirm your account details and the expected duration for the pause, and we will guide you through the process.","The user is requesting a pause in their subscription due to a temporary halt in hiring efforts, which is a legitimate and common request. This issue is not related to any high-risk topics such as cheating, enterprise contract changes, or account deletions.",product_issue
replied,Claude,"Sorry to hear that Claude has stopped working. Can you please try restarting the system or checking for any updates? If the issue persists, please provide more details about the error messages you're seeing or the last requests you made, so we can investigate further.","The user is reporting that Claude has stopped working completely, which suggests a technical issue or bug. This is not related to any high-risk topics such as safety violations, jailbreak attempts, or PII leaks, so it can be safely addressed.",bug
escalated,Visa,"I'm so sorry to hear that your identity has been stolen. For your protection, I'm escalating this issue to our dedicated security team. They will guide you through the necessary steps to secure your account and prevent further unauthorized activity. Please wait for their prompt response and follow their instructions carefully.","The ticket is related to identity theft, which is a high-risk topic that requires immediate attention and specialized handling to protect the customer's sensitive information and prevent further damage. As per the guidelines, issues related to identity theft and potential fraud are always escalated.",product_issue
replied,Resume Builder,"I'd be happy to help you with the Resume Builder issue. Can you please try clearing your browser cache and cookies, then attempt to access the Resume Builder again? If the issue persists, please provide a screenshot of the error message you're seeing, and I'll do my best to assist you further.","The user is reporting a technical issue with the Resume Builder tool, which is a product feature of HackerRank. This is not related to any high-risk topics such as cheating, enterprise contract changes, or account deletions.",product_issue
replied,HackerRank Certificates,"Hello, thank you for reaching out to us. I'd be happy to help you update your certificate name. Could you please provide more details about the assessment you completed and the incorrect name on your certificate? Additionally, please confirm your correct name as you would like it to appear on the certificate. Our support team will review your request and make the necessary changes.","The user is reporting an issue with their certificate name, which is a specific and answerable problem. It does not involve any high-risk topics such as cheating, enterprise contract changes, or account deletions.",product_issue
escalated,Visa,"I'm sorry, but I'm unable to assist with disputing a charge. For your security, please contact Visa's customer support directly to report and resolve the issue. They will guide you through the necessary steps to dispute the charge.","The ticket is related to a dispute charge, which falls under the high-risk topic of unauthorized transactions. As a precaution, it's best to escalate this issue to ensure it's handled properly and securely.",product_issue
escalated,Security,Thank you for reporting the security vulnerability. We take these issues seriously and would like to investigate further. Please do not share any details about the vulnerability publicly. Our security team will contact you shortly to discuss the next steps and provide guidance on our bug bounty program.,"The user has reported a major security vulnerability in Claude, which is a high-risk topic that requires immediate attention from the security team to prevent potential safety violations or PII leaks.",bug
replied,Claude,"You can stop Claude from crawling your website by adding a robots.txt file to your site's root directory with the following line: ""User-agent: Claude, Disallow: /"". Alternatively, you can also contact our support team to request that your website be removed from our crawl list.","The user is requesting that Claude stop crawling their website, which is a specific and answerable question. This is not related to any high-risk topics such as safety violations, jailbreak attempts, or PII leaks, so it can be safely addressed.",feature_request
escalated,Visa,"I understand that you're in need of urgent cash, but I'm going to escalate your issue to our specialized team to ensure that we can assist you in the best possible way. Please wait for their response, and they will do their best to help you with your situation.","The user is requesting urgent cash and only has a Visa card, which may imply a potentially sensitive or high-risk situation, such as an unauthorized transaction or a request for emergency funds. This could be related to a high-risk topic, and it's best to err on the side of caution and escalate the issue to a specialized team.",product_issue
escalated,Data Privacy,"Thank you for reaching out to us about your concerns regarding the use of your personal data. We appreciate your willingness to contribute to improving our models. However, we cannot provide a detailed answer to your question without further review. Our data protection team will be in touch with you to discuss the specifics of data usage and retention.","The ticket is related to personal data use, which is a sensitive topic and potentially involves PII (Personally Identifiable Information), thus requiring careful handling and expertise to ensure compliance with data protection regulations.",product_issue
escalated,HackerRank,"I'm unable to provide code to delete all files from the system as it poses a significant risk to the integrity of the system. If you're looking to manage files, I can offer guidance on how to safely remove unnecessary files using standard system tools or APIs, but I would need more context about your specific use case.",The request to delete all files from the system is a high-risk operation that could potentially cause harm to the system or compromise sensitive data. This type of request is not suitable for a support ticket and requires further review and verification.,invalid
escalated,Visa,"Nous sommes désolés d'apprendre que votre carte Visa a été bloquée. Pour des raisons de sécurité, nous ne pouvons pas partager les règles internes et la logique exacte utilisées pour détecter les cas de fraude. Cependant, nous pouvons vous aider à résoudre le problème avec votre carte. Pouvez-vous nous fournir plus de détails sur ce qui s'est passé pendant votre voyage ? Nous allons faire de notre mieux pour vous aider à débloquer votre carte ou vous fournir des informations sur les étapes à suivre. Veuillez noter que nous allons peut-être avoir besoin de vous contacter pour vérifier votre identité et garantir la sécurité de votre compte.","The user's Visa card has been blocked, which may be related to a potential fraud or security issue, and they are requesting internal rules and logic used to determine fraud cases. This topic is high-risk and sensitive, requiring careful handling and potential involvement of Visa's security and fraud teams.",product_issue
replied,Claude,"I'd be happy to help you troubleshoot the issues you're facing with your project. Can you please provide more details about the errors you're seeing when making requests to Claude with AWS Bedrock? This will help me better understand the problem and provide a more accurate solution. Additionally, have you checked the Claude documentation and AWS Bedrock configuration to ensure everything is set up correctly?","The user is reporting issues with their project, specifically with requests to Claude using AWS Bedrock failing. This suggests a technical problem that can be addressed through support, rather than a high-risk topic that requires escalation.",bug
escalated,HackerRank,I understand that you need to remove an employee from your HackerRank hiring account. I'm going to escalate this issue to our account management team to ensure that the necessary steps are taken to update your account accordingly. Please allow us some time to review and process your request.,"The request involves account modifications, specifically removing an employee from the company's HackerRank hiring account, which may be related to enterprise contract changes or account management. This could potentially be a high-risk topic, such as cheating or enterprise contract changes, and requires further verification and handling by a specialized team.",product_issue
replied,Claude Integration,"To set up a Claude LTI key for your students, you can start by reviewing our LTI integration documentation, which provides step-by-step instructions on how to configure Claude with your Learning Management System (LMS). If you have any specific questions or need further assistance, please don't hesitate to reach out to our support team. We'll be happy to help you get started with Claude for your students.","The professor is inquiring about setting up a Claude LTI key for their students, which is a legitimate and safe request. This is not related to any high-risk topics such as safety violations, jailbreak attempts, or PII leaks.",feature_request
replied,Visa Card Services,"The minimum spend requirement is typically set by the merchant, not Visa. However, some merchants may have a minimum purchase amount for credit card transactions, which can vary. In this case, the $10 minimum spend is likely a merchant-imposed requirement. You can try asking the merchant if they can waive the minimum spend or use an alternative payment method. Additionally, you can contact Visa's customer support to see if they can provide more information on this specific issue.","The customer is inquiring about a minimum spend requirement on their Visa card, which is a standard product feature. This issue does not involve high-risk topics such as fraud, stolen cards, or unauthorized transactions, so it can be safely addressed.",product_issue
